{
  "version": "1.0",
  "generated_at": "2026-06-02T09:59:02.682451+00:00",
  "templates": [
    {
      "template_id": "classic_five_act",
      "label": "起承转合型",
      "play_count": 1122,
      "example_script_ids": [
        "01001001",
        "01001002",
        "01001003",
        "01001005",
        "01001006",
        "01001007",
        "01001009",
        "01001010",
        "01001012",
        "01001013"
      ],
      "stage_proportions": {
        "结局": 0.254,
        "其他": 0.0731,
        "冲突": 0.1314,
        "铺垫": 0.17,
        "高潮": 0.148,
        "发展": 0.2235
      }
    },
    {
      "template_id": "conflict_heavy",
      "label": "冲突密集型",
      "play_count": 267,
      "example_script_ids": [
        "01001004",
        "01001008",
        "01001011",
        "01002004",
        "01002005",
        "01002009",
        "01002014",
        "01002015",
        "01002017",
        "01002020"
      ],
      "stage_proportions": {
        "结局": 0.1764,
        "冲突": 0.4104,
        "铺垫": 0.1387,
        "高潮": 0.104,
        "发展": 0.1705
      }
    },
    {
      "template_id": "slow_opening",
      "label": "铺垫冗长型",
      "play_count": 69,
      "example_script_ids": [
        "01001015",
        "01001018",
        "01002007",
        "01005009",
        "01007004",
        "01007006",
        "01007016",
        "01009005",
        "01009013",
        "01009014"
      ],
      "stage_proportions": {
        "结局": 0.1094,
        "冲突": 0.1388,
        "铺垫": 0.4973,
        "高潮": 0.1111,
        "发展": 0.1434
      }
    },
    {
      "template_id": "climax_front",
      "label": "高潮前置型",
      "play_count": 15,
      "example_script_ids": [
        "01006014",
        "01012016",
        "01017012",
        "01018004",
        "01027007",
        "01034007",
        "02003021",
        "02006025",
        "02010016",
        "03006001"
      ],
      "stage_proportions": {
        "结局": 0.1647,
        "冲突": 0.0989,
        "铺垫": 0.2206,
        "高潮": 0.4153,
        "发展": 0.1005
      }
    }
  ],
  "by_genre": [
    {
      "genre": "历史剧",
      "play_count": 834,
      "avg_stage_lengths": {
        "结局": 0.2362,
        "其他": 0.042,
        "冲突": 0.1917,
        "铺垫": 0.1774,
        "高潮": 0.1437,
        "发展": 0.209
      }
    },
    {
      "genre": "家庭剧",
      "play_count": 435,
      "avg_stage_lengths": {
        "结局": 0.2243,
        "其他": 0.0851,
        "冲突": 0.1643,
        "铺垫": 0.1794,
        "高潮": 0.1358,
        "发展": 0.2111
      }
    },
    {
      "genre": "爱情剧",
      "play_count": 124,
      "avg_stage_lengths": {
        "结局": 0.2193,
        "其他": 0.0565,
        "冲突": 0.1937,
        "铺垫": 0.1932,
        "高潮": 0.1416,
        "发展": 0.1958
      }
    },
    {
      "genre": "侠义剧",
      "play_count": 56,
      "avg_stage_lengths": {
        "结局": 0.2391,
        "冲突": 0.1816,
        "铺垫": 0.2094,
        "高潮": 0.1423,
        "发展": 0.2277
      }
    },
    {
      "genre": "公案剧",
      "play_count": 12,
      "avg_stage_lengths": {
        "结局": 0.4406,
        "其他": 0.0833,
        "冲突": 0.0416,
        "铺垫": 0.1615,
        "高潮": 0.099,
        "发展": 0.1739
      }
    },
    {
      "genre": "神话剧",
      "play_count": 12,
      "avg_stage_lengths": {
        "结局": 0.1341,
        "其他": 0.1667,
        "冲突": 0.1727,
        "铺垫": 0.1511,
        "高潮": 0.1729,
        "发展": 0.2026
      }
    }
  ]
}
