{
  "version": "1.0",
  "generated_at": "2026-05-29T04:28:43.334762+00:00",
  "templates": [
    {
      "template_id": "classic_five_act",
      "label": "起承转合型",
      "play_count": 1173,
      "example_script_ids": [
        "01001001",
        "01001002",
        "01001003",
        "01001004",
        "01001005",
        "01001006",
        "01001007",
        "01001008",
        "01001009",
        "01001010"
      ],
      "stage_proportions": {
        "冲突": 0.1291,
        "其他": 0.0887,
        "铺垫": 0.1647,
        "结局": 0.2486,
        "高潮": 0.1427,
        "发展": 0.2261
      }
    },
    {
      "template_id": "conflict_heavy",
      "label": "冲突密集型",
      "play_count": 231,
      "example_script_ids": [
        "01001011",
        "01002008",
        "01002015",
        "01002020",
        "01003002",
        "01003015",
        "01003017",
        "01005009",
        "01005011",
        "01006005"
      ],
      "stage_proportions": {
        "冲突": 0.4719,
        "铺垫": 0.1116,
        "结局": 0.1794,
        "高潮": 0.0722,
        "发展": 0.1649
      }
    },
    {
      "template_id": "slow_opening",
      "label": "铺垫冗长型",
      "play_count": 67,
      "example_script_ids": [
        "01001017",
        "01001018",
        "01002001",
        "01003001",
        "01007004",
        "01007006",
        "01007016",
        "01009002",
        "01009005",
        "01011013"
      ],
      "stage_proportions": {
        "冲突": 0.135,
        "铺垫": 0.4936,
        "结局": 0.1306,
        "高潮": 0.1143,
        "发展": 0.1265
      }
    },
    {
      "template_id": "climax_front",
      "label": "高潮前置型",
      "play_count": 2,
      "example_script_ids": [
        "01018005",
        "70901133"
      ],
      "stage_proportions": {
        "冲突": 0.0807,
        "铺垫": 0.0971,
        "结局": 0.2314,
        "高潮": 0.3727,
        "发展": 0.2182
      }
    }
  ],
  "by_genre": [
    {
      "genre": "历史剧",
      "play_count": 834,
      "avg_stage_lengths": {
        "冲突": 0.1952,
        "其他": 0.0576,
        "铺垫": 0.1697,
        "结局": 0.232,
        "高潮": 0.1348,
        "发展": 0.2108
      }
    },
    {
      "genre": "家庭剧",
      "play_count": 435,
      "avg_stage_lengths": {
        "冲突": 0.1645,
        "其他": 0.1011,
        "铺垫": 0.1653,
        "结局": 0.2329,
        "高潮": 0.1232,
        "发展": 0.2131
      }
    },
    {
      "genre": "爱情剧",
      "play_count": 124,
      "avg_stage_lengths": {
        "冲突": 0.1898,
        "其他": 0.0645,
        "铺垫": 0.1877,
        "结局": 0.2099,
        "高潮": 0.1376,
        "发展": 0.2104
      }
    },
    {
      "genre": "侠义剧",
      "play_count": 56,
      "avg_stage_lengths": {
        "冲突": 0.1663,
        "铺垫": 0.2117,
        "结局": 0.2456,
        "高潮": 0.1277,
        "发展": 0.2487
      }
    },
    {
      "genre": "公案剧",
      "play_count": 12,
      "avg_stage_lengths": {
        "冲突": 0.049,
        "其他": 0.1667,
        "铺垫": 0.1432,
        "结局": 0.3971,
        "高潮": 0.0793,
        "发展": 0.1648
      }
    },
    {
      "genre": "神话剧",
      "play_count": 12,
      "avg_stage_lengths": {
        "冲突": 0.1608,
        "其他": 0.1667,
        "铺垫": 0.1585,
        "结局": 0.2477,
        "高潮": 0.1156,
        "发展": 0.1506
      }
    }
  ]
}
